{
  "$schema": "https://json-schema.org/draft/2020-12/schema",
  "$id": "https://schemas.kumwe.org/studio/v1/entry.schema.json",
  "title": "Studio content entry",
  "type": "object",
  "additionalProperties": false,
  "required": ["contractVersion", "kind", "id", "revision", "model", "status", "values"],
  "properties": {
    "contractVersion": { "$ref": "common.schema.json#/$defs/contractVersion" },
    "kind": { "const": "entry" },
    "id": { "$ref": "common.schema.json#/$defs/stableId" },
    "revision": { "$ref": "common.schema.json#/$defs/revision" },
    "model": { "$ref": "common.schema.json#/$defs/lockedArtifactReference" },
    "status": { "enum": ["draft", "in-review", "published", "archived"] },
    "locale": { "$ref": "common.schema.json#/$defs/locale" },
    "translationOf": { "$ref": "common.schema.json#/$defs/stableId" },
    "workflowState": { "$ref": "common.schema.json#/$defs/qualifiedName" },
    "values": {
      "type": "object",
      "maxProperties": 10000,
      "propertyNames": { "$ref": "common.schema.json#/$defs/localName" },
      "additionalProperties": { "$ref": "common.schema.json#/$defs/jsonValue" }
    },
    "compositionOverrides": {
      "type": "object",
      "maxProperties": 1000,
      "propertyNames": { "$ref": "common.schema.json#/$defs/stableId" },
      "additionalProperties": { "$ref": "common.schema.json#/$defs/jsonValue" }
    },
    "extensions": { "$ref": "common.schema.json#/$defs/extensions" }
  }
}
